hits_page_pageTitle,time_diff
Backpacks,0 days 00:00:13.689320388
Metal Texture Roller Pen,0 days 00:00:13.636363636
Google Women's Fleece Hoodie,0 days 00:00:13.404255319
Google Bongo Cupholder Bluetooth Speaker,0 days 00:00:13.333333333
Google Women's Short Sleeve V-Neck Tee Lavender,0 days 00:00:13.333333333
Google Women's Performance Golf Polo Blue,0 days 00:00:13.333333333
Stickers | Accessories | Google Merchandise Store,0 days 00:00:13.210773834
The Google Merchandise Store/Google G Noise-reducing Bluetooth Headphones,0 days 00:00:13.043478260
Google Women's Quilted Insulated Vest Pewter,0 days 00:00:12.857142857
The Google Merchandise Store/Blue Metallic Textured Spiral Notebook Set,0 days 00:00:12.857142857
Google Onesie Royal Blue,0 days 00:00:12.857142857
Google PowerKit,0 days 00:00:12.857142857
Google Wool Heather Cap Heather/Navy,0 days 00:00:12.631578947
Google Lunch Bag,0 days 00:00:12.631578947
Google Women's Long Sleeve Tee Lavender,0 days 00:00:12.631578947
Satin Black Ballpoint Pen,0 days 00:00:12.631578947
Google Trucker Hat,0 days 00:00:12.500000
Google 40 oz Insulated Monster Bottle,0 days 00:00:12.500000
Stickers,0 days 00:00:12.352941176
Google Collapsible Pet Bowl,0 days 00:00:12.352941176
The Google Merchandise Store/Recycled Mouse Pad,0 days 00:00:12.244897959
Waze Pack of 9 Decal Set,0 days 00:00:12
Accessories | Electronics | Google Merchandise Store - https://shop.googlemerchandisestore.com/Google+Redesign/electronics/electronics+accessories,0 days 00:00:12
Android Men's 3/4 Sleeve Raglan Henley Black,0 days 00:00:12
Google Youth Short Sleeve Tee Red,0 days 00:00:12
Google Women's Recycled Fabric Tee,0 days 00:00:12
Android Youth Short Sleeve T-shirt Aqua,0 days 00:00:12
Android Onesie Gold,0 days 00:00:12
The Google Merchandise Store/Metal Earbuds with Small Zipper Case,0 days 00:00:12
The Google Merchandise Store/Eco-Aware Large Recycled Journal Combo,0 days 00:00:12
Google 3/4 Sleeve Raglan Henley Grey,0 days 00:00:12
Set of 3 Nested Travel Cases,0 days 00:00:12
Google Women's Short Sleeve Hero Tee Dark Grey,0 days 00:00:12
Google Men's Long Sleeve Pullover Crew Tee Heather,0 days 00:00:12
Android Women's Short Sleeve Badge Tee Dark Heather,0 days 00:00:12
Kid's-Toddler,0 days 00:00:11.501154734
YouTube Men's Long Sleeve Pullover Badge Tee Heather,0 days 00:00:11.428571428
20 oz Stainless Steel Insulated Tumbler,0 days 00:00:11.320754716
Google Women's Short Sleeve Performance Tee Navy,0 days 00:00:11.250000
Bluetooth Headphones,0 days 00:00:11.250000
Google Electronics Accessory Pouch,0 days 00:00:11.200000
Electronics Accessories,0 days 00:00:10.967741935
The Google Merchandise Store/Gift Card - $25.00,0 days 00:00:10.909090909
More Bags,0 days 00:00:10.872483221
Google Youth Girl Hoodie,0 days 00:00:10.500000
Google Infuser-Top Water Bottle,0 days 00:00:10.434782608
Leather and Metal Ballpoint Pen,0 days 00:00:10.434782608
Google Stretch Fit Hat,0 days 00:00:10.434782608
Four Color Retractable Pen,0 days 00:00:10.344827586
Android Glass Water Bottle with Black Sleeve,0 days 00:00:10.344827586
The Google Merchandise Store/Leatherette Journal,0 days 00:00:10.256410256
Notebooks & Journals,0 days 00:00:10.194986072
mochilas | bolsas | Google tienda de artículos,0 days 00:00:10
Google Men's Performance Tee Gunmetal,0 days 00:00:10
Google Hard Cover Journal,0 days 00:00:10
Google Women's Short Sleeve Shirt Dark Grey,0 days 00:00:10
Android Luggage Tag,0 days 00:00:10
Retractable Ballpoint Pen Red,0 days 00:00:10
Google Water Resistant Bluetooth Speaker,0 days 00:00:09.767441860
Google Men's Short Sleeve Hero Tee Light Blue,0 days 00:00:09.230769230
Google Women's 1/4 Zip Jacket Charcoal,0 days 00:00:09.230769230
The Google Merchandise Store/Crunch-It Dog Toy,0 days 00:00:08.571428571
The Google Merchandise Store/Rocket Flashlight,0 days 00:00:08.571428571
Item Unavailable,0 days 00:00:08.571428571
Google Tube Power Bank,0 days 00:00:08.372093023
Pet,0 days 00:00:08.155339805
YouTube Twill Cap,0 days 00:00:07.826086956
Crunch Noise Dog Toy,0 days 00:00:07.500000
Google Youth Short Sleeve T-shirt Green,0 days 00:00:07.500000
Android Sticker Sheet Ultra Removable,0 days 00:00:07.200000
YouTube Custom Decals,0 days 00:00:07.058823529
The Google Merchandise Store/Gift Card - $100.00,0 days 00:00:06
Google Men's Vintage Badge Tee Green,0 days 00:00:06
Google Tote Bag,0 days 00:00:06
The Google Merchandise Store/Chevron Shopper,0 days 00:00:06
Android 25 oz Green Apple Stainless Steel Bottle,0 days 00:00:06
Google Women's Short Sleeve Hero Tee Sky Blue,0 days 00:00:06
The Google Merchandise Store/Red Spiral Google Notebook,0 days 00:00:05.853658536
Android Infant Short Sleeve Tee Pink,0 days 00:00:05.714285714
The Google Merchandise Store/Colored Pencil Set,0 days 00:00:05.454545454
8 pc Android Sticker Sheet,0 days 00:00:05.106382978
YouTube Men's Short Sleeve Hero Tee White,0 days 00:00:05
The Google Merchandise Store/Blue Keeper Notebook Set with Flap,0 days 00:00:03.750000
Google Insulated Stainless Steel Bottle,0 days 00:00:03.461538461
Camisa androide BTTF Cosmos,0 days 00:00:00
Android Men's Vintage Tank,0 days 00:00:00
Google Infant Short Sleeve Tee Green,0 days 00:00:00
Android Infant Short Sleeve Tee Pewter,0 days 00:00:00
Yoga Mat Blue,0 days 00:00:00
Google Infant Short Sleeve Tee Red,0 days 00:00:00
Writing Instruments | Office | Google Merchandise Store - https://shop.googlemerchandisestore.com/Google+Redesign/office/writing+instruments,0 days 00:00:00
Android Hombres de la sudadera,0 days 00:00:00
Category Unavailable,0 days 00:00:00
Google Los hombres de la sudadera,0 days 00:00:00
Google Men's Heavyweight Long Sleeve Hero Tee Burgundy,0 days 00:00:00
Android Hard Cover Journal,0 days 00:00:00
Google Men's Long Sleeve Baseball Raglan Cranberry,0 days 00:00:00
Google Men's Performance Badge Tee Navy,0 days 00:00:00
Android 24 oz botella Contigo,0 days 00:00:00
audio | Electrónica | Google tienda de artículos,0 days 00:00:00
You Tube Toddler Short Sleeve Tee Red,0 days 00:00:00
Google Infant Short Sleeve Tee Cornflower Blue,0 days 00:00:00
YouTube Women's Short Sleeve Crew Tee,0 days 00:00:00
Google Hombres camiseta de manga corta de la insignia del carbón de leña,0 days 00:00:00
Compact Eco Journal,0 days 00:00:00
Botellas de agua y vasos | Vasos | Google tienda de artículos,0 days 00:00:00
YouTube Onesie Heather,0 days 00:00:00
Desgaste del funcionamiento de los hombres | prendas de vestir | Google tienda de artículos,0 days 00:00:00
Envio Su Información,0 days 00:00:00
Flashlights | Electronics | Google Merchandise Store - https://shop.googlemerchandisestore.com/Google+Redesign/electronics/flashlights,0 days 00:00:00
Google Adult Tee Fruit Games Pineapple,0 days 00:00:00
Google Bib White,0 days 00:00:00
Google Collapsible Duffel Black,0 days 00:00:00
Apparel | Google tienda de artículos,0 days 00:00:00
Android Women's Racer Back Tank Black,0 days 00:00:00
Android Stretch Fit Hat M/L,0 days 00:00:00
Google Flashlight,0 days 00:00:00
Android Onesie Baby Blue,0 days 00:00:00
YouTube Infant Short Sleeve Tee Red,0 days 00:00:00
The Google Merchandise Store/16 oz. Hot/Cold Tumbler,0 days 00:00:00
Waze Men's Typography Short Sleeve Tee,0 days 00:00:00
Google Mochila para portátil,0 days 00:00:00
PaperMate Ink Joy Retractable Pen,0 days 00:00:00
The Google Merchandise Store/Mistral Rucksack,0 days 00:00:00
Google vendimia Henley Gris / Negro,0 days 00:00:00
Home - https://shop.googlemerchandisestore.com/store.html?vid=20160512512,0 days 00:00:00
Housewares | Accessories | Google Merchandise Store - https://shop.googlemerchandisestore.com/Google+Redesign/Accessories/Housewares,0 days 00:00:00
Kids,0 days 00:00:00
La tienda de artículos de Google / 24 oz botella de YouTube sargento raya,0 days 00:00:00
Nest® Learning Thermostat 3rd Gen-USA - Stainless Steel,0 days 00:00:00
Notebooks & Journals | Office | Google Merchandise Store - https://shop.googlemerchandisestore.com/Google+Redesign/Office/Notebooks++Journals,0 days 00:00:00
Other | Office | Google Merchandise Store - https://shop.googlemerchandisestore.com/Google+Redesign/office/office+other,0 days 00:00:00
PaperMate Ink Joy Pen,0 days 00:00:00
Payment Method - https://shop.googlemerchandisestore.com/payment.html,0 days 00:00:00
Google Toddler Short Sleeve T-shirt Green,0 days 00:00:00
Payment Method - https://shop.googlemerchandisestore.com/payment.html?vid=20160512512&securitytoken=10cdcba0-bbc6-11e6-b9ae-b12c50996a10,0 days 00:00:00
The Google Merchandise Store/Deluge Waterproof Backpack,0 days 00:00:00
Pedido de la opinión,0 days 00:00:00
Power & Chargers | Electronics | Google Merchandise Store - https://shop.googlemerchandisestore.com/store.html?cid=42057&vid=20160512512&tpt=4532&sortci=price+asc,0 days 00:00:00
Shipping Information - https://shop.googlemerchandisestore.com/store-policies/shipping-information,0 days 00:00:00
Shopping & Totes | Bags | Google Merchandise Store - https://shop.googlemerchandisestore.com/Google+Redesign/bags/shopping+and+Totes,0 days 00:00:00
Stadium Cups-Sets of 4,0 days 00:00:00
T-Shirts | prendas de vestir | Google tienda de artículos,0 days 00:00:00
The Google Merchandise Store/Android 24 oz Contigo Bottle,0 days 00:00:00
The Google Merchandise Store/ATOM Wireless Earbud Headset,0 days 00:00:00
The Google Merchandise Store/Oasis Backpack,0 days 00:00:00
Google hombres ponen en cortocircuito la manga Rendimiento Badge Tee del estaño,0 days 00:00:00
Google hombres ponen en cortocircuito la manga Rendimiento Badge Tee Negro,0 days 00:00:00
Google hombres ponen en cortocircuito la manga Rendimiento Badge Tee Armada,0 days 00:00:00
Google Toddler Short Sleeve Tee Red,0 days 00:00:00
Google Tri-mezcla con capucha gris,0 days 00:00:00
Waze Women's Typography Short Sleeve Tee,0 days 00:00:00
Waze Mood Happy Window Decal,0 days 00:00:00
The Google Merchandise Store - My Account - https://shop.googlemerchandisestore.com/myaccount.html?mode=vieworder&vid=20160512512,0 days 00:00:00
Google Women's Performance Hero Tee Gunmetal,0 days 00:00:00
Google Women's Performance Tee Gunmetal,0 days 00:00:00
Water Bottles & Tumblers | Drinkware | Google Merchandise Store - https://shop.googlemerchandisestore.com/Google+Redesign/bags/water+bottles+and+tumblers,0 days 00:00:00
16 oz. Hot and Cold Tumbler,0 days 00:00:00
Google Women's Short Sleeve Shirt Blue,0 days 00:00:00
Google Women's Short Sleeve Shirt Red,0 days 00:00:00
Google Women's Short Sleeve V-Neck Tee Black,0 days 00:00:00
Google Women's Short Sleeve V-Neck Tee Stone,0 days 00:00:00
Google Women's Softshell Jacket Black/Grey,0 days 00:00:00
Google Women's Tank Top,0 days 00:00:00
The Google Merchandise Store/Solo Pro Backpack,0 days 00:00:00
Google Youth Baseball Raglan Heather/Black,0 days 00:00:00
Google Youth Tee Fruit Games Pineapple,0 days 00:00:00
Google botella de agua de 22 oz,0 days 00:00:00
The Google Merchandise Store/PowerClip Lightning Charger,0 days 00:00:00
The Google Merchandise Store/Pop-a-Point Crayon,0 days 00:00:00
"10,400mAh cargador de alta capacidad de Google",0 days 00:00:00
Google Adult Tee Fruit Games Cherries,
