hits_page_pageTitle,time_diff
Shopping Cart - https://shop.googlemerchandisestore.com/basket.html?vid=20160512512,0 days 00:08:00
The Google Merchandise Store/UFO Bluetooth Water Resistant Speaker,0 days 00:04:00
Android Men's Engineer Short Sleeve Tee Charcoal,0 days 00:01:56.470588235
The Google Merchandise Store/Plastic Sliding Flashlight,0 days 00:01:55.384615384
Potencia y Cargadores | Electrónica | Google tienda de artículos,0 days 00:01:50
Android Stretch Fit Hat,0 days 00:01:30
Google Toddler Short Sleeve T-shirt Grey,0 days 00:01:30
Android Wool Heather Cap Heather/Black,0 days 00:01:28.571428571
Gunmetal Roller Ball Pen,0 days 00:01:28
Google Men's Pullover Hoodie,0 days 00:01:27.272727272
Google Men's Short Sleeve Performance Badge Tee Charcoal,0 days 00:01:25.263157894
Google Men's Long Sleeve Raglan Cranberry,0 days 00:01:24
Google Accent Insulated Stainless Steel Bottle,0 days 00:01:20.869565217
Google Men's Vintage Badge Tee Sage,0 days 00:01:18.260869565
Android Baby Essentials Baby Set,0 days 00:01:17.142857142
Android Men's Take Charge Short Sleeve Tee Purple,0 days 00:01:15.652173913
Women's YouTube Short Sleeve Hero Tee Black,0 days 00:01:15
Android Onesie Sprout Green,0 days 00:01:13.333333333
Google Men's 3/4 Sleeve Raglan Henley Grey,0 days 00:01:10
Google Men's Bike Short Sleeve Tee Charcoal,0 days 00:01:08.135593220
Android Men's Long Sleeve Badge Crew Tee Heather,0 days 00:01:08
Google Women's Short Sleeve Badge Tee Grey,0 days 00:01:03.333333333
YouTube Men's Vintage Henley,0 days 00:01:02.857142857
Payment Method,0 days 00:01:02.552413456
Frequently Asked Questions,0 days 00:01:01.428571428
Power & Chargers | Electronics | Google Merchandise Store - https://shop.googlemerchandisestore.com/Google+Redesign/Electronics/Power,0 days 00:01:00
Google Women's Badge Performance Tee Black,0 days 00:01:00
Fun | Accessories | Google Merchandise Store - https://shop.googlemerchandisestore.com/Google+Redesign/Accessories/Fun,0 days 00:01:00
Mugs & Cups | Drinkware | Google Merchandise Store - https://shop.googlemerchandisestore.com/Google+Redesign/drinkware/mugs+and+cups,0 days 00:01:00
Checkout Review - https://shop.googlemerchandisestore.com/revieworder.html?vid=20160512512&cspResult=CheckoutSuccess&currentDate=Tue+Dec+06+10%3A20%3A50+EST+2016,0 days 00:01:00
Checkout Your Information - https://shop.googlemerchandisestore.com/yourinfo.html?vid=20160512512,0 days 00:01:00
Google Adult Tee Fruit Games Dragonfruit,0 days 00:01:00
Shopping Cart - https://shop.googlemerchandisestore.com/basket.html?vid=20160512512&executedAction=addItem&executeActionStatus=true,0 days 00:01:00
Pet Collapsi-Bowl,0 days 00:01:00
Sports & Fitness | Accessories | Google Merchandise Store - https://shop.googlemerchandisestore.com/Google+Redesign/Accessories/Sports++Fitness,0 days 00:01:00
Google masculino 100% algodón de manga corta T-héroe Negro,0 days 00:01:00
YouTube Men's 3/4 Sleeve Henley,0 days 00:01:00
Yoga Mat Purple,0 days 00:01:00
The Google Merchandise Store - Log In - https://shop.googlemerchandisestore.com/signin.html?vid=20160512512&mt=3,0 days 00:01:00
The Google Merchandise Store - Log In - https://shop.googlemerchandisestore.com/registersuccess.html?vid=20160512512&opco=true,0 days 00:01:00
Google Online Store - https://www.googlemerchandisestore.com/,0 days 00:01:00
YouTube Men's Fleece Hoodie Black,0 days 00:01:00
YouTube Womens 3/4 Sleeve Baseball Raglan White/Black,0 days 00:01:00
Google Los hombres de la sudadera con capucha gris,0 days 00:01:00
Google Youth Short Sleeve T-shirt Yellow,0 days 00:01:00
The Google Merchandise Store - My Account,0 days 00:00:59.131483715
The Google Merchandise Store - Register,0 days 00:00:58.467741935
Google Men's Long Sleeve Pullover Badge Tee Heather,0 days 00:00:57.391304347
Google Women's Long Sleeve Blended Cardigan Charcoal,0 days 00:00:56.842105263
Google Youth Short Sleeve T-shirt Royal Blue,0 days 00:00:56.250000
Google Toddler Short Sleeve Tee White,0 days 00:00:56
Google Women's Weatherblock Shell Jacket Black,0 days 00:00:55.135135135
The Google Merchandise Store/22 oz Mini Mountain Bottle,0 days 00:00:55.135135135
Google Women's Short Sleeve Hero Tee Grey,0 days 00:00:55
Shipping Information,0 days 00:00:54.545454545
The Google Merchandise Store/Compact Selfie Stick,0 days 00:00:54.146341463
YouTube Women's Fleece Hoodie Black,0 days 00:00:54
Google Men's Short Sleeve Performance Badge Tee Pewter,0 days 00:00:53.076923076
Google Women's Scoop Neck Tee Black,0 days 00:00:53.076923076
Android Men's Short Sleeve Tri-blend Hero Tee Grey,0 days 00:00:52.941176470
Google Women's Short Sleeve Badge Tee Navy,0 days 00:00:52.941176470
Checkout Your Information,0 days 00:00:52.260934025
Reusable Shopping Bag,0 days 00:00:51.891891891
Checkout Review,0 days 00:00:50.915865856
Google Women's Short Sleeve Hero Tee Heather,0 days 00:00:50.769230769
Compact Journal with Recycled Pages,0 days 00:00:50
Google Women's Scoop Neck Tee Green,0 days 00:00:50
YouTube Women's Short Sleeve Tri-blend Badge Tee Charcoal,0 days 00:00:49.411764705
Android Men's Paradise Short Sleeve Tee Olive,0 days 00:00:49.090909090
BLM Sweatshirt,0 days 00:00:48.607594936
Google Men's Short Sleeve Performance Badge Tee Black,0 days 00:00:46.666666666
The Google Merchandise Store/Windup Android,0 days 00:00:46.500000
Google Men's Pullover Hoodie Grey,0 days 00:00:46
Spring Sale,0 days 00:00:45.714285714
Android Men's Long & Lean Badge Tee Charcoal,0 days 00:00:45
Android Spiral Journal with Pen,0 days 00:00:45
Google Toddler Short Sleeve T-shirt Yellow,0 days 00:00:45
YouTube Wool Heather Cap Heather/Black,0 days 00:00:45
Google Women's Convertible Vest-Jacket Black,0 days 00:00:44.285714285
The Google Merchandise Store/1 oz Hand Sanitizer,0 days 00:00:42.857142857
Google Men's Short Sleeve Performance Badge Tee Navy,0 days 00:00:42.857142857
Google Men's Skater Tee Charcoal,0 days 00:00:42.500000
Google Toddler 1/4 Zip Fleece Pewter,0 days 00:00:42
Men's Weatherblock Shell Jacket Black,0 days 00:00:41.538461538
Google Men's Short Sleeve Hero Tee Charcoal,0 days 00:00:41.311475409
Your Wishlist,0 days 00:00:40.941176470
The Google Merchandise Store/Galaxy Screen Cleaning Cloth,0 days 00:00:40.588235294
Google Baby Essentials Set,0 days 00:00:40.540540540
Google Men's Performance 1/4 Zip Pullover Heather/Black,0 days 00:00:40.344827586
Google Women's Short Sleeve Hero Tee White,0 days 00:00:40.273972602
Google Men's Watershed Full Zip Hoodie Grey,0 days 00:00:40.178571428
Google Women's Short Sleeve Hero V-Neck Tee Black,0 days 00:00:40
Google Phone Sanitizer,0 days 00:00:40
Compact Bluetooth Speaker,0 days 00:00:40
The Google Merchandise Store/SPF-15 Slim & Slender Lip Balm,0 days 00:00:40
Android Twill Cap,0 days 00:00:40
Google Women's Hero V-Neck Tee White,0 days 00:00:40
Women's Performance Full Zip Jacket Black,0 days 00:00:40
Google Women's Short Sleeve Performance Tee Pewter,0 days 00:00:40
Google Women's Scoop Neck Tee White,0 days 00:00:40
Android Men's Skater Badge Tee Charcoal,0 days 00:00:40
Google Men's 100% Cotton Short Sleeve Hero Tee Red,0 days 00:00:39.310344827
Clearance Sale,0 days 00:00:39.200000
SPF-15 Slim & Slender Lip Balm,0 days 00:00:39
The Google Merchandise Store - Log In,0 days 00:00:38.724946695
The Google Merchandise Store/Maze Pen,0 days 00:00:38.620689655
Google Heavyweight Long Sleeve Hero Tee Navy,0 days 00:00:38.571428571
Google Men's Airflow 1/4 Zip Pullover Lapis,0 days 00:00:38.571428571
Google Men's Around The Block Short Sleeve Tee Ash,0 days 00:00:38.400000
Google Men's Quilted Insulated Vest Battleship Grey,0 days 00:00:38.297872340
Google Men's Performance Full Zip Jacket Black,0 days 00:00:38.181818181
Google Women's Short Sleeve Performance Tee Charcoal,0 days 00:00:38.181818181
UpCycled Handlebar Bag,0 days 00:00:38.181818181
Google Women's Short Sleeve Performance Tee Black,0 days 00:00:37.500000
YouTube Notebook and Pen Set,0 days 00:00:37.500000
YouTube Spiral Journal with Pen,0 days 00:00:36.923076923
Google | Shop by Brand | Google Merchandise Store,0 days 00:00:36.697490092
Google Women's Muscle Tee,0 days 00:00:36.666666666
Google Women's Vintage Hero Tee Black,0 days 00:00:36.666666666
Google Men's Zip Hoodie,0 days 00:00:36.219512195
Android Heavyweight Long Sleeve Badge Tee Black,0 days 00:00:36
"Google High Capacity 10,400mAh Charger",0 days 00:00:36
Google Youth Sports Tee Navy,0 days 00:00:36
Google Spiral Leather Journal,0 days 00:00:36
Google Men's Long & Lean Tee Charcoal,0 days 00:00:36
Google Women's Colorblock Tee White,0 days 00:00:36
Google Men's Colorblock Tee White/Heather,0 days 00:00:36
Google Tri-blend Hoodie Grey,0 days 00:00:35.853658536
Google Women's Short Sleeve Hero Tee Black,0 days 00:00:35.625000
Page Unavailable,0 days 00:00:35.543478260
YouTube Hard Cover Journal,0 days 00:00:35.454545454
Google Women's Quilted Insulated Vest White,0 days 00:00:35.384615384
Google Men's Performance Hero Tee Gunmetal,0 days 00:00:35.172413793
Google Infant Short Sleeve Tee Royal Blue,0 days 00:00:35
Google Kick Ball,0 days 00:00:34.186046511
Android | Shop by Brand | Google Merchandise Store,0 days 00:00:33.966942148
Foam Can and Bottle Cooler,0 days 00:00:33.818181818
Google Leather Journal,0 days 00:00:33.626373626
Google Spiral Journal with Pen,0 days 00:00:33.600000
Android BTTF Cosmos Shirt,0 days 00:00:33.529411764
Checkout Confirmation,0 days 00:00:33.382863990
The Google Merchandise Store/Gift Card - $250.00,0 days 00:00:33.333333333
Android Women's Short Sleeve Hero Tee Black,0 days 00:00:33.333333333
Google Women's Yoga Jacket Black,0 days 00:00:33.191489361
YouTube Trucker Hat,0 days 00:00:32.727272727
Micro Wireless Earbud,0 days 00:00:32.307692307
Rocket Flashlight,0 days 00:00:32.307692307
YouTube Men's Short Sleeve Hero Tee Black,0 days 00:00:32.307692307
Google Doodle Decal,0 days 00:00:32.054794520
Google Men's Weatherblock Shell Jacket Black,0 days 00:00:32
Yoga Mat,0 days 00:00:31.875000
Google Women's Yoga Pants,0 days 00:00:31.764705882
The Google Merchandise Store/Svanasana Yoga Block,0 days 00:00:31.764705882
Home,0 days 00:00:31.760733236
Google 2200mAh Micro Charger,0 days 00:00:31.578947368
The Google Merchandise Store/14 oz Jumbo Ceramic Mug,0 days 00:00:31.343283582
Rainbow Stylus Pen,0 days 00:00:31.304347826
Google 3/4 Sleeve Raglan Badge Henley Black,0 days 00:00:31.304347826
Google Men's Microfiber 1/4 Zip Pullover Grey/Black,0 days 00:00:31.200000
Google Women's Short Sleeve Hero Tee Red Heather,0 days 00:00:30.857142857
Return Policy,0 days 00:00:30.666666666
Kids' Apparel | Google Merchandise Store,0 days 00:00:30.344827586
Shop by Brand | Google Merchandise Store,0 days 00:00:30.285714285
Google Men's 100% Cotton Short Sleeve Hero Tee Black,0 days 00:00:30.275229357
Women's Apparel | Google Merchandise Store,0 days 00:00:30.104287369
Google Pet Feeding Mat,0 days 00:00:30
The Google Merchandise Store/BRIGHTtravels Set of 3 Packing Cubes,0 days 00:00:30
Google Laptop and Cell Phone Stickers,0 days 00:00:30
Google Women's 1/4 Zip Performance Pullover Two-Tone Blue,0 days 00:00:30
YouTube Men's Vintage Tee,0 days 00:00:30
Android Infant Short Sleeve Tee Aqua,0 days 00:00:30
Android Women's Short Sleeve Badge Tee Light Charcoal,0 days 00:00:30
Google Women's Tank Top Light Gray,0 days 00:00:30
Bic Digital Clic Stic Stylus Pen,0 days 00:00:30
Google Infant Short Sleeve Tee White,0 days 00:00:30
Terms of Use,0 days 00:00:30
Google Women's Vintage Hero Tee Platinum,0 days 00:00:30
The Google Merchandise Store/PaperMate Ink Joy RT Pen,0 days 00:00:30
Android Men's Short Sleeve Hero Tee White,0 days 00:00:30
Google Men's Long & Lean Tee Grey,0 days 00:00:30
The Google Merchandise Store/Quatro Retractable Pen,0 days 00:00:30
Android Youth Short Sleeve T-shirt Pewter,0 days 00:00:30
YouTube Men's Eco-Jersey Henley,0 days 00:00:30
Checkout Confirmation - https://shop.googlemerchandisestore.com/ordercompleted.html?vid=20160512512&orderDataId=13146,0 days 00:00:30
Electronics | Google Merchandise Store,0 days 00:00:29.704433497
Google Men's Vintage Badge Tee Black,0 days 00:00:29.347826086
Google Alpine Style Backpack,0 days 00:00:29.032258064
Google RFID Journal,0 days 00:00:28.571428571
Android Toddler Short Sleeve T-shirt Pewter,0 days 00:00:28.235294117
Apparel | Google Merchandise Store,0 days 00:00:28.016949152
Google Women's 1/4 Zip Performance Pullover Black,0 days 00:00:28
The Google Merchandise Store/Grip Kit Cable Organizer,0 days 00:00:27.692307692
Ballpoint Stylus Pen,0 days 00:00:27.692307692
Drinkware | Google Merchandise Store,0 days 00:00:27.597173144
Switch Tone Color Crayon Pen,0 days 00:00:27.096774193
The Google Merchandise Store/Waterpoof Gear Bag,0 days 00:00:26.666666666
Google Women's Vintage Hero Tee Lavender,0 days 00:00:26.666666666
Google Men's Heavyweight Long Sleeve Hero Tee Navy,0 days 00:00:26.666666666
Google Executive Umbrella,0 days 00:00:26.470588235
Mugs and Cups,0 days 00:00:26.400000
Google Men's Softshell Jacket Black/Grey,0 days 00:00:26.250000
Shopping Cart,0 days 00:00:25.907052323
Office | Google Merchandise Store,0 days 00:00:25.857461024
Shopping and Totes,0 days 00:00:25.777777777
YouTube Women's Short Sleeve Hero Tee Charcoal,0 days 00:00:25.714285714
YouTube RFID Journal,0 days 00:00:25.714285714
Waterproof Backpack,0 days 00:00:25.662650602
Google Men's Performance Polo Grey/Black,0 days 00:00:25.531914893
Men's Apparel | Google Merchandise Store,0 days 00:00:25.512129380
Google Power Bank,0 days 00:00:24.590163934
Google Women's Shell Jacket Blue/Black,0 days 00:00:24.545454545
Executive Twist Ballpoint Pen,0 days 00:00:24.545454545
Google Luggage Tag,0 days 00:00:24.444444444
YouTube | Shop by Brand | Google Merchandise Store,0 days 00:00:24.363636363
Google Vintage Henley Grey/Black,0 days 00:00:24.285714285
Google Women's 3/4 Sleeve Baseball Raglan Heather/Black,0 days 00:00:24.255319148
The Google Merchandise Store/Red Shine 15 oz Mug,0 days 00:00:24.166666666
Google Onesie Green,0 days 00:00:24
Women's Weatherblock Shell Jacket Black,0 days 00:00:24
Ballpoint Stick Pen 4 Pack,0 days 00:00:24
Android Men's Vintage Henley,0 days 00:00:24
Google Stretch Fit Hat L/XL Navy,0 days 00:00:24
Google Toddler Sports T-shirt Red,0 days 00:00:24
Android Men's Pep Rally Short Sleeve Tee Navy,0 days 00:00:24
YouTube Luggage Tag,0 days 00:00:24
Android Women's Long Sleeve Blended Cardigan Grey,0 days 00:00:23.750000
Women's Outerwear | Apparel | Google Merchandise Store,0 days 00:00:23.661464585
Google Snapback Hat Black,0 days 00:00:23.636363636
Google Women's Vintage Hero Tee White,0 days 00:00:23.636363636
Shop by Brand,0 days 00:00:23.636363636
Kid's-Infant,0 days 00:00:23.606557377
Android Lunch Kit,0 days 00:00:23.478260869
Housewares | Accessories | Google Merchandise Store,0 days 00:00:23.329949238
Google Men's Quilted Insulated Vest Black,0 days 00:00:23.250000
Google Pocket Bluetooth Speaker,0 days 00:00:23.076923076
Bags | Google Merchandise Store,0 days 00:00:23.042735042
Women's,0 days 00:00:23.005780346
Accessories | Google Merchandise Store,0 days 00:00:22.886937431
Clip-on Compact Charger,0 days 00:00:22.857142857
Google Men's Long Sleeve Raglan Ocean Blue,0 days 00:00:22.666666666
Fun,0 days 00:00:22.657342657
Men's T-Shirts | Apparel | Google Merchandise Store,0 days 00:00:22.510074841
25L Classic Rucksack,0 days 00:00:22.400000
Recycled Paper Journal Set,0 days 00:00:22.344827586
Housewares,0 days 00:00:22.317073170
YouTube Men's Short Sleeve Hero Tee Charcoal,0 days 00:00:22.285714285
Google Women's V-Neck Tee Charcoal,0 days 00:00:22.222222222
Google Men's Short Sleeve Hero Tee Heather,0 days 00:00:22.105263157
Google Women's Quilted Insulated Vest Black,0 days 00:00:22.105263157
Google Women's Performance Full Zip Jacket Black,0 days 00:00:22.025316455
Women's T-Shirts | Apparel | Google Merchandise Store,0 days 00:00:21.949806949
Keyboard DOT Sticker,0 days 00:00:21.818181818
Google Women's Insulated Thermal Vest Navy,0 days 00:00:21.818181818
Google Men's Lightweight Microfleece Jacket Black,0 days 00:00:21.750000
Android BTTF Moonshot Shirt,0 days 00:00:21.724137931
The Google Merchandise Store/Bottle Opener Clip,0 days 00:00:21.724137931
Ballpoint Pen Blue,0 days 00:00:21.538461538
Softsided Travel Pouch Set,0 days 00:00:21.290322580
Android Toddler Short Sleeve T-shirt Pink,0 days 00:00:21.176470588
Android 17oz Stainless Steel Sport Bottle,0 days 00:00:21.176470588
The Google Merchandise Store/24 oz USA Made Aluminum Bottle,0 days 00:00:21.176470588
YouTube Men's Vintage Tank,0 days 00:00:21.176470588
Android Lifted Men's Short Sleeve Tee Blue,0 days 00:00:21.176470588
Google Zipper-front Sports Bag,0 days 00:00:21
Google 22 oz Water Bottle,0 days 00:00:20.890688259
Other | Office | Google Merchandise Store,0 days 00:00:20.831918505
Google Men's Airflow 1/4 Zip Pullover Black,0 days 00:00:20.769230769
Google 25 oz Red Stainless Steel Bottle,0 days 00:00:20.769230769
Rubber Grip Ballpoint Pen 4 Pack,0 days 00:00:20.727272727
Google Toddler Hoodie Royal Blue,0 days 00:00:20.689655172
Google Stylus Pen w/ LED Light,0 days 00:00:20.625000
The Google Merchandise Store/Basecamp Explorer Powerbank Flashlight,0 days 00:00:20.571428571
Google Women's Lightweight Microfleece Jacket,0 days 00:00:20.487804878
Apparel,0 days 00:00:20.410132689
Men's Outerwear | Apparel | Google Merchandise Store,0 days 00:00:20.146241591
Infant | Kids' Apparel | Google Merchandise Store,0 days 00:00:20.125000
The Google Merchandise Store/Ballpoint & Matching Tube Case,0 days 00:00:20
Android Women's Short Sleeve Tri-blend Badge Tee Light Blue,0 days 00:00:20
The Google Merchandise Store/Latitudes Foldaway Shopper,0 days 00:00:20
Android Women's Fleece Hoodie,0 days 00:00:20
Google Youth Girl Tee Green,0 days 00:00:20
Waze Baby on Board Window Decal,0 days 00:00:20
Rendimiento héroe Google camiseta de los hombres gris oscuro,0 days 00:00:20
Digital Lightshow Smart Speaker and Notification Center,0 days 00:00:20
Koozie Can Kooler,0 days 00:00:20
Google Men's Vintage Tank,0 days 00:00:20
"The Google Merchandise Store/7"" Dog Safe Flyer",0 days 00:00:20
Google Women's Tee Purple,0 days 00:00:20
Google 25 oz Blue Stainless Steel Bottle,0 days 00:00:20
Google Laptop Tech Backpack,0 days 00:00:20
Grip Highlighter Pen 3 Pack,0 days 00:00:20
Google Women's Tee Grey,0 days 00:00:20
The Google Merchandise Store/Speed Zone Air Mesh Tote,0 days 00:00:20
Electrónica,0 days 00:00:20
Waze Dress Socks,0 days 00:00:20
YouTube Women's Racer Back Tank Black,0 days 00:00:20
Android RFID Journal,0 days 00:00:20
Men's Performance Wear | Apparel | Google Merchandise Store,0 days 00:00:19.964695498
Audio | Electronics | Google Merchandise Store,0 days 00:00:19.925788497
Office Other,0 days 00:00:19.800000
The Google Merchandise Store/Malibu Sunglasses,0 days 00:00:19.699812382
Insulated Bottle,0 days 00:00:19.565217391
Android Rise 14 oz Mug,0 days 00:00:19.534883720
Google Men's Short Sleeve Badge Tee Charcoal,0 days 00:00:19.534883720
Writing Instruments | Office | Google Merchandise Store,0 days 00:00:19.480037140
Google Infant Zip Hood Pink,0 days 00:00:19.459459459
Sports & Fitness | Accessories | Google Merchandise Store,0 days 00:00:19.441340782
Google Laptop Backpack,0 days 00:00:19.411764705
Google,0 days 00:00:19.211822660
The Google Merchandise Store/22 oz Android Bottle,0 days 00:00:19.090909090
Google Device Holder Sticky Pad,0 days 00:00:19.090909090
Water Bottles & Tumblers | Drinkware | Google Merchandise Store,0 days 00:00:19.019337016
The Google Merchandise Store/22 oz YouTube Bottle Infuser,0 days 00:00:18.947368421
Android Men's Short Sleeve Hero Tee Heather,0 days 00:00:18.947368421
Notebooks & Journals | Office | Google Merchandise Store,0 days 00:00:18.796747967
Google Long Sleeve Raglan Badge Henley Ocean Blue,0 days 00:00:18.750000
Google Heavyweight Long Sleeve Hero Tee Burgundy,0 days 00:00:18.750000
Audio,0 days 00:00:18.500000
Women's-Outerwear,0 days 00:00:18.494318181
Google Youth Short Sleeve Tee White,0 days 00:00:18.461538461
Google Women's Convertible Vest-Jacket Sea Foam Green,0 days 00:00:18.367346938
Suitcase Organizer Cubes,0 days 00:00:18.333333333
Google Online Store,0 days 00:00:18.128342245
YouTube Men's Skater Tee Charcoal,0 days 00:00:18
Google Women's Vintage T-Shirt Black,0 days 00:00:18
Gift Cards,0 days 00:00:18
The Google Merchandise Store/BRIGHTtravels Seat Pack Organizer,0 days 00:00:18
Google Toddler Raglan Shirt Blue Heather/Navy,0 days 00:00:18
Google 17oz Stainless Steel Sport Bottle,0 days 00:00:18
Google Toddler Short Sleeve T-shirt Royal Blue,0 days 00:00:18
Color Changing Grip Pen,0 days 00:00:17.910447761
Android 24 oz Contigo Bottle,0 days 00:00:17.894736842
Google Rucksack,0 days 00:00:17.796610169
Android,0 days 00:00:17.784431137
YouTube,0 days 00:00:17.727272727
Flashlights,0 days 00:00:17.727272727
Kids-Youth,0 days 00:00:17.682119205
Google Infant Zip Hood Royal Blue,0 days 00:00:17.647058823
Backpacks | Bags | Google Merchandise Store,0 days 00:00:17.529258777
Headgear | Apparel | Google Merchandise Store,0 days 00:00:17.470588235
Writing Instruments,0 days 00:00:17.444089456
Google Men's 100% Cotton Short Sleeve Hero Tee Navy,0 days 00:00:17.333333333
Google Women's V-Neck Tee Grey,0 days 00:00:17.142857142
Audio | Electronics | Google Merchandise Store - https://shop.googlemerchandisestore.com/Google+Redesign/Electronics/Audio,0 days 00:00:17.142857142
Google Women's Short Sleeve Badge Tee Red Heather,0 days 00:00:17.142857142
The Google Merchandise Store/Ballpoint LED Light Pen,0 days 00:00:17.142857142
Google Womens 3/4 Sleeve Baseball Raglan Heather/Black,0 days 00:00:17.142857142
Google Slim Utility Travel Bag,0 days 00:00:17.142857142
YouTube Leatherette Notebook Combo,0 days 00:00:16.981132075
Google 25 oz Clear Stainless Steel Bottle,0 days 00:00:16.923076923
Women's Performance Wear | Apparel | Google Merchandise Store,0 days 00:00:16.899563318
Men's-Outerwear,0 days 00:00:16.850393700
Accessories | Electronics | Google Merchandise Store,0 days 00:00:16.842105263
Google Car Clip Phone Holder,0 days 00:00:16.800000
Google Women's Zip Hoodie Grey,0 days 00:00:16.800000
Google Ballpoint Pen Black,0 days 00:00:16.800000
Electronics,0 days 00:00:16.798825256
Spiral Notebook and Pen Set,0 days 00:00:16.701030927
Women's-T-Shirts,0 days 00:00:16.691729323
Micro Wireless Earbuds,0 days 00:00:16.666666666
Men's-Performance Wear,0 days 00:00:16.666666666
Drinkware,0 days 00:00:16.595208070
Google Men's Skater Tee Grey,0 days 00:00:16.551724137
Google Men's Vintage Badge Tee White,0 days 00:00:16.551724137
Women's-Performance Wear,0 days 00:00:16.500000
More Bags | Bags | Google Merchandise Store,0 days 00:00:16.474953617
Men's,0 days 00:00:16.426735218
Youth | Kids' Apparel | Google Merchandise Store,0 days 00:00:16.408839779
Sports & Fitness,0 days 00:00:16.363636363
Google Men's Convertible Vest-Jacket Pewter,0 days 00:00:16.363636363
The Google Merchandise Store/Pen Pencil & Highlighter Set,0 days 00:00:16.363636363
Android Toddler Short Sleeve T-shirt Aqua,0 days 00:00:16.363636363
YouTube Youth Short Sleeve Tee Red,0 days 00:00:16.363636363
Google Onesie Red,0 days 00:00:16.363636363
Google Men's Bayside Graphic Tee,0 days 00:00:16.190476190
Shopping & Totes | Bags | Google Merchandise Store,0 days 00:00:16.176302232
Google Twill Cap,0 days 00:00:16.056338028
The Google Merchandise Store/24 oz YouTube Sergeant Stripe Bottle,0 days 00:00:16
Fun | Accessories | Google Merchandise Store,0 days 00:00:15.931914893
Mugs & Cups | Drinkware | Google Merchandise Store,0 days 00:00:15.806451612
Gel Roller Pen,0 days 00:00:15.789473684
Google 17 oz Double Wall Stainless Steel Insulated Bottle,0 days 00:00:15.789473684
Accessories,0 days 00:00:15.737704918
Kid's,0 days 00:00:15.700934579
Pet | Accessories | Google Merchandise Store,0 days 00:00:15.640138408
Store search results,0 days 00:00:15.620623806
Flashlights | Electronics | Google Merchandise Store,0 days 00:00:15.562500
Toddler | Kids' Apparel | Google Merchandise Store,0 days 00:00:15.557673975
Android Journal Book Set,0 days 00:00:15.555555555
Water Bottles and Tumblers,0 days 00:00:15.433526011
Google Canvas Tote Natural/Navy,0 days 00:00:15.306122448
Fruit Games,0 days 00:00:15.227272727
Office,0 days 00:00:15.103668261
Men's-T-Shirts,0 days 00:00:15.088757396
Power & Chargers | Electronics | Google Merchandise Store,0 days 00:00:15.033860045
The Google Merchandise Store/Gift Card - $50.00,0 days 00:00:15
Google Women's Performance Polo Grey/Black,0 days 00:00:15
Google Men's Performance Badge Tee Black,0 days 00:00:15
Men's Softshell Jacket Black/Grey,0 days 00:00:15
The Google Merchandise Store/Straw Beach Mat,0 days 00:00:15
Android Men's Vintage Tee,0 days 00:00:15
YouTube Women's Short Sleeve Tri-blend Badge Tee Grey,0 days 00:00:15
Bic Intensity Clic Gel Pen,0 days 00:00:15
Google Onesie Red/Graphite,0 days 00:00:15
Google Women's Short Sleeve V-Neck Tee Dark Grey,0 days 00:00:15
Lifestyle,0 days 00:00:14.836546521
Headgear,0 days 00:00:14.791666666
Badge Holder,0 days 00:00:14.693877551
Power,0 days 00:00:14.666666666
Google Men's 100% Cotton Short Sleeve Hero Tee White,0 days 00:00:14.666666666
Android Men's Zip Hoodie,0 days 00:00:14.545454545
The Google Merchandise Store/Fashion Sunglasses & Pouch,0 days 00:00:14.482758620
Google Metallic Notebook Set,0 days 00:00:14.400000
Google Bluetooth Speaker-Power Bank,0 days 00:00:14.285714285
Aluminum Handy Emergency Flashlight,0 days 00:00:14.117647058
Gift Cards | Google Merchandise Store,0 days 00:00:14.055415617
23 oz Wide Mouth Sport Bottle,0 days 00:00:14.042553191
26 oz Double Wall Insulated Bottle,0 days 00:00:14.042553191
Bags,0 days 00:00:14.027364663
Collapsible Shopping Bag,0 days 00:00:14.025974025
Google 4400mAh Power Bank,0 days 00:00:13.846153846
Google Collapsible Duffel,0 days 00:00:13.770491803
Google Men's Microfiber 1/4 Zip Pullover Blue/Indigo,0 days 00:00:13.714285714
